"id","resumeId","companyName","title","startDate","endDate","location","responsibilities","technologies","createdAt","updatedAt"
"7","3","Rackspace Technology","Software Engineer","2022-04-01",,"Austin, TX","[""Developed and optimized React and Node.js applications with Material UI, CSS3, and SQL for cloud-monitoring and cost-optimization dashboards, delivering faster load times and higher user adoption among enterprise clients."",""Implemented REST and GraphQL APIs for data aggregation and analytics, improving API response performance by 30%."",""Automated infrastructure provisioning and configuration with Terraform and AWS CloudFormation, standardizing environment creation."",""Built CI/CD pipelines using GitHub Actions and Docker, reducing deployment time by 50%."",""Collaborated with DevOps and product teams to implement logging, alerting, and monitoring using CloudWatch and Prometheus, improving system reliability and enabling faster incident detection."",""Conducted code reviews on GitHub pull requests, mentored interns on using Git and Jest, and enforced coding standards with ESLint, resulting in fewer code defects and faster onboarding of new team members.""]","[""React"",""Node.js"",""Material UI"",""CSS3"",""SQL"",""AWS"",""Terraform"",""GitHub Actions"",""Docker""]","2026-03-15 23:07:54.267","2026-03-15 23:07:54.267"
"8","3","HomeAway (Vrbo / Expedia Group)","Web Developer","2020-02-01","2022-03-01","Austin, TX","[""Built and maintained user-facing web interfaces for vacation-rental management using React, Redux, and TypeScript, resulting in smoother navigation and higher user satisfaction."",""Collaborated with backend engineers to design RESTful APIs using OpenAPI and integrated booking, payment, and listing services, which streamlined transaction processing and reduced integration errors."",""Implemented responsive UI components with Material UI, adhering to WCAG accessibility standards and mobile-first design, which enhanced usability for users on all devices and improved compliance scores."",""Migrated legacy AngularJS modules to React Hooks and Context API, reducing technical debt and improving maintainability."",""Participated in CI/CD pipeline setup using Jenkins and Terraform for staging and production deployments, which cut release time by half and lowered deployment-related errors."",""Worked closely with QA to implement automated end-to-end testing in Cypress, improving release confidence.""]","[""React"",""Redux"",""TypeScript"",""Material UI"",""AngularJS"",""Jenkins"",""Terraform"",""Cypress""]","2026-03-15 23:07:54.267","2026-03-15 23:07:54.267"
"9","3","Code Authority","Junior Software Developer","2020-08-01","2021-01-01","Plano, TX","[""Assisted in developing full-stack web applications for healthcare and retail clients using Django, React, and JavaScript, collaborating via GitHub for version control, which enabled timely delivery of client features."",""Designed relational database schemas and built CRUD APIs with Python and PostgreSQL, employing the SQLAlchemy ORM, which streamlined data access for the applications."",""Deployed containerized applications using Docker and authored Bash automation scripts for data migration, reducing manual migration effort and accelerating release cycles."",""Supported the development of internal tools to automate QA workflows and improve build reliability.""]","[""Django"",""React"",""JavaScript"",""PostgreSQL"",""Docker"",""Bash""]","2026-03-15 23:07:54.267","2026-03-15 23:07:54.267"
"10","4","EPIC","Senior Software Engineer","2023-11-01","2025-10-01","Remote","[""Built and optimized RESTful APIs and microservices using Node.js and NestJS to support financial data integrations and improve system performance."",""Architected scalable backend services supporting financial web and mobile applications using Node.js."",""Developed reusable UI components with React and TailwindCSS to maintain a consistent design system across financial products."",""Implemented Python-based data processing services to automate analytics and reporting workflows."",""Collaborated with designers, product managers, and mobile engineers to deliver new features and improve product functionality."",""Containerized services with Docker and deployed applications within AWS infrastructure."",""Implemented CI/CD pipelines and automated testing to improve deployment reliability and release speed."",""Mentored engineers and led engineering discussions on architecture and product improvements.""]","[""React"",""Node.js"",""NestJS"",""Python"",""TailwindCSS"",""Docker"",""AWS"",""CI/CD""]","2026-03-16 06:34:54.151","2026-03-16 06:34:54.151"
"11","4","Paxos","Senior Software Engineer","2020-06-01","2023-10-01","Remote","[""Developed consumer-facing financial web applications using React, TypeScript, Python, and Django."",""Maintained frontend architecture and established code quality standards across the engineering team."",""Diagnosed and resolved operational issues to ensure reliability of mission-critical financial systems."",""Collaborated with business stakeholders to translate financial and regulatory requirements into technical solutions."",""Managed millions of financial transaction records using PostgreSQL while ensuring data integrity and compliance."",""Improved infrastructure performance and deployment pipelines to increase engineering delivery velocity."",""Built automated testing suites using Jest and Cypress to improve software quality."",""Mentored junior engineers and conducted code reviews to maintain engineering standards.""]","[""React"",""TypeScript"",""Python"",""Django"",""PostgreSQL"",""Jest"",""Cypress""]","2026-03-16 06:34:54.151","2026-03-16 06:34:54.151"